{"id": "rcc-slab", "name": "RCC slab (flat)", "category": "building/slab", "kind": "parametric", "tags": ["slab", "concrete", "host"], "units": "mm", "parameters": {"L": {"min": 1000, "max": 20000, "default": 4000}, "W": {"min": 1000, "max": 12000, "default": 4000}, "T": {"min": 100, "max": 300, "default": 150}}, "shapes": [{"id": "slab", "role": "solid", "type": "box", "size": ["$L", "$W", "$T"], "at": [0, 0, "$T/2"]}], "ports": [{"id": "B", "at": [0, 0, 0], "dir": [0, 0, -1], "type": "face-v"}, {"id": "T", "at": [0, 0, "$T"], "dir": [0, 0, 1], "type": "face-v"}]}