{"id": "brick-wall", "name": "Brick wall (straight)", "category": "building/wall", "kind": "parametric", "tags": ["wall", "masonry"], "units": "mm", "parameters": {"L": {"min": 500, "max": 8000, "default": 3000}, "t": {"min": 100, "max": 400, "default": 230}, "H": {"min": 1000, "max": 4500, "default": 3000}}, "shapes": [{"id": "wall", "role": "solid", "type": "box", "size": ["$L", "$t", "$H"], "at": [0, 0, "$H/2"]}], "ports": [{"id": "R", "at": ["$L/2", 0, 0], "dir": [1, 0, 0], "type": "face-h"}, {"id": "L", "at": ["-$L/2", 0, 0], "dir": [-1, 0, 0], "type": "face-h"}, {"id": "T", "at": [0, 0, "$H"], "dir": [0, 0, 1], "type": "face-v"}, {"id": "B", "at": [0, 0, 0], "dir": [0, 0, -1], "type": "face-v"}]}