{"id": "gate", "name": "Gate between piers", "category": "building/gate", "kind": "parametric", "tags": ["gate"], "units": "mm", "parameters": {"W": {"min": 1500, "max": 8000, "default": 3000}, "H": {"min": 1200, "max": 3000, "default": 2000}, "t": {"min": 150, "max": 350, "default": 230}}, "shapes": [{"id": "leaf", "role": "solid", "type": "box", "size": ["$W-500", 50, "$H-150"], "at": [0, 0, "150+($H-150)/2"], "tags": ["steel"]}, {"id": "pierL", "role": "solid", "type": "box", "size": [250, "$t", "$H+250"], "at": ["-$W/2+125", 0, "($H+250)/2"], "tags": ["concrete"]}, {"id": "pierR", "role": "solid", "type": "box", "size": [250, "$t", "$H+250"], "at": ["$W/2-125", 0, "($H+250)/2"], "tags": ["concrete"]}], "ports": [{"id": "L", "at": ["-$W/2", 0, 0], "dir": [-1, 0, 0], "type": "face-h"}, {"id": "R", "at": ["$W/2", 0, 0], "dir": [1, 0, 0], "type": "face-h"}]}