{"id": "boundary-wall", "name": "Boundary wall with coping", "category": "building/boundary", "kind": "parametric", "tags": ["wall", "masonry"], "units": "mm", "parameters": {"L": {"min": 1000, "max": 8000, "default": 3000}, "t": {"min": 150, "max": 350, "default": 230}, "H": {"min": 1200, "max": 3000, "default": 2000}}, "shapes": [{"id": "wall", "role": "solid", "type": "box", "size": ["$L", "$t", "$H"], "at": [0, 0, "$H/2"]}, {"id": "coping", "role": "solid", "type": "box", "size": ["$L", "$t+60", 60], "at": [0, 0, "$H+30"], "tags": ["concrete"]}], "ports": [{"id": "R", "at": ["$L/2", 0, 0], "dir": [1, 0, 0], "type": "face-h"}, {"id": "L", "at": ["-$L/2", 0, 0], "dir": [-1, 0, 0], "type": "face-h"}, {"id": "T", "at": [0, 0, "$H+60"], "dir": [0, 0, 1], "type": "face-v"}, {"id": "B", "at": [0, 0, 0], "dir": [0, 0, -1], "type": "face-v"}]}